case,problem,nfp,policy,max_mode,ess,status,success,crashed,objective_final,aspect_final,iota_final,wall_time_min,qi_legacy_total,qi_mirror_ratio_max,qi_max_elongation,message,output_dir
qi_nfp1,qi,1,continuation,3,yes,partial,no,yes,2.2862673619025347e+00,7.0380119480186103e+00,4.7904655539809893e-01,1.293722,6.3843977097425174e-03,2.8396562382557328e-01,4.1322202251143620e+00,QI staged subprocess timed out after 1140.0 s; QI staged subprocess exited with code 124; partial QI stage checkpoint metrics recorded,examples/optimization/results/minimal_seed_showcase/cpu/qi_nfp1/continuation/nfp1_qi/mode3/ess
qi_nfp2,qi,2,continuation,3,yes,partial,no,yes,9.7446719430297013e-01,8.0720009687841969e+00,-4.5282873990525407e-01,1.269672,2.4812956652942621e-03,2.4097383493048224e-01,4.6181613032545936e+00,QI staged subprocess timed out after 1140.0 s; QI staged subprocess exited with code 124; partial QI stage checkpoint metrics recorded,examples/optimization/results/minimal_seed_showcase/cpu/qi_nfp2/continuation/nfp2_qi/mode3/ess
qi_nfp3,qi,3,continuation,3,yes,partial,no,yes,2.6332650238051247e+02,3.5124710716300398e+00,-9.0165180859092431e-01,3.513196,3.8436111192552219e-01,1.0000000000000000e+00,3.9651042823113758e+00,QI staged subprocess timed out after 1140.0 s; QI staged subprocess exited with code 124; partial QI stage checkpoint metrics recorded,examples/optimization/results/minimal_seed_showcase/cpu/qi_nfp3/continuation/qi_stel_seed_3127/mode3/ess
qa_nfp2,qa,2,continuation,3,yes,partial,no,yes,5.6350039754064015e-04,5.0007305254921324e+00,4.1999155035338820e-01,18.995448,,,,exit code -15; partial checkpoint after QA mode 3; case still running,examples/optimization/results/minimal_seed_showcase/cpu/qa_nfp2/continuation/mode3/ess
qh_nfp4,qh,4,continuation,3,yes,ok,yes,no,3.2206994231376552e-03,5.0003251316297623e+00,-1.2077678182382841e+00,7.094831,,,,`xtol` termination condition is satisfied.,examples/optimization/results/minimal_seed_showcase/cpu/qh_nfp4/continuation/mode3/ess
qp_nfp2,qp,2,continuation,3,yes,incomplete,no,no,8.5870791516803681e+20,1.7736366340896147e+01,8.0640817690915656e-01,6.537697,,,,scipy least_squares failed; returning best exact accepted point: array must not contain infs or NaNs,examples/optimization/results/minimal_seed_showcase/cpu/qp_nfp2/continuation/mode3/ess
